{
  "schema": "minuto-a-minuto/v1/serie-minuto",
  "eleicao": {
    "id": "2022-2t",
    "ano": 2022,
    "turno": 2,
    "data": "2022-10-30",
    "cargo": "presidente",
    "cd_eleicao_tse": "545",
    "inicio_divulgacao": "2022-10-30T17:00:00-03:00"
  },
  "local": {
    "nivel": "uf",
    "sigla": "PB",
    "nome": "Paraíba"
  },
  "candidatos": [
    {
      "numero": "13",
      "nome_urna": "LULA",
      "partido": "PT"
    },
    {
      "numero": "22",
      "nome_urna": "JAIR BOLSONARO",
      "partido": "PL"
    }
  ],
  "pontos": [
    {"t":"2022-10-30T17:00:00-03:00","seg_desde_inicio":0,"secoes":0,"pct_secoes":0.0,"aptos":0,"comparecimento":0,"votos":{"13":0,"22":0,"branco":0,"nulo":0}},
    {"t":"2022-10-30T17:01:00-03:00","seg_desde_inicio":60,"secoes":0,"pct_secoes":0.0,"aptos":0,"comparecimento":0,"votos":{"13":0,"22":0,"branco":0,"nulo":0}},
    {"t":"2022-10-30T17:02:00-03:00","seg_desde_inicio":120,"secoes":0,"pct_secoes":0.0,"aptos":0,"comparecimento":0,"votos":{"13":0,"22":0,"branco":0,"nulo":0}},
    {"t":"2022-10-30T17:03:00-03:00","seg_desde_inicio":180,"secoes":0,"pct_secoes":0.0,"aptos":0,"comparecimento":0,"votos":{"13":0,"22":0,"branco":0,"nulo":0}},
    {"t":"2022-10-30T17:04:00-03:00","seg_desde_inicio":240,"secoes":0,"pct_secoes":0.0,"aptos":0,"comparecimento":0,"votos":{"13":0,"22":0,"branco":0,"nulo":0}},
    {"t":"2022-10-30T17:05:00-03:00","seg_desde_inicio":300,"secoes":0,"pct_secoes":0.0,"aptos":0,"comparecimento":0,"votos":{"13":0,"22":0,"branco":0,"nulo":0}},
    {"t":"2022-10-30T17:06:00-03:00","seg_desde_inicio":360,"secoes":0,"pct_secoes":0.0,"aptos":0,"comparecimento":0,"votos":{"13":0,"22":0,"branco":0,"nulo":0}},
    {"t":"2022-10-30T17:07:00-03:00","seg_desde_inicio":420,"secoes":0,"pct_secoes":0.0,"aptos":0,"comparecimento":0,"votos":{"13":0,"22":0,"branco":0,"nulo":0}},
    {"t":"2022-10-30T17:08:00-03:00","seg_desde_inicio":480,"secoes":5,"pct_secoes":0.0521,"aptos":1535,"comparecimento":1330,"votos":{"13":688,"22":557,"branco":12,"nulo":73}},
    {"t":"2022-10-30T17:09:00-03:00","seg_desde_inicio":540,"secoes":12,"pct_secoes":0.125,"aptos":4027,"comparecimento":3424,"votos":{"13":1871,"22":1352,"branco":40,"nulo":161}},
    {"t":"2022-10-30T17:10:00-03:00","seg_desde_inicio":600,"secoes":13,"pct_secoes":0.1354,"aptos":4419,"comparecimento":3752,"votos":{"13":2027,"22":1505,"branco":43,"nulo":177}},
    {"t":"2022-10-30T17:11:00-03:00","seg_desde_inicio":660,"secoes":21,"pct_secoes":0.2187,"aptos":7242,"comparecimento":6141,"votos":{"13":3376,"22":2404,"branco":70,"nulo":291}},
    {"t":"2022-10-30T17:12:00-03:00","seg_desde_inicio":720,"secoes":31,"pct_secoes":0.3228,"aptos":10780,"comparecimento":9196,"votos":{"13":5053,"22":3596,"branco":108,"nulo":439}},
    {"t":"2022-10-30T17:13:00-03:00","seg_desde_inicio":780,"secoes":45,"pct_secoes":0.4687,"aptos":15768,"comparecimento":13352,"votos":{"13":7321,"22":5262,"branco":151,"nulo":618}},
    {"t":"2022-10-30T17:14:00-03:00","seg_desde_inicio":840,"secoes":61,"pct_secoes":0.6353,"aptos":21257,"comparecimento":17995,"votos":{"13":9781,"22":7186,"branco":212,"nulo":816}},
    {"t":"2022-10-30T17:15:00-03:00","seg_desde_inicio":900,"secoes":93,"pct_secoes":0.9685,"aptos":32052,"comparecimento":26952,"votos":{"13":15386,"22":9996,"branco":324,"nulo":1246}},
    {"t":"2022-10-30T17:16:00-03:00","seg_desde_inicio":960,"secoes":123,"pct_secoes":1.281,"aptos":42533,"comparecimento":35753,"votos":{"13":20290,"22":13433,"branco":422,"nulo":1608}},
    {"t":"2022-10-30T17:17:00-03:00","seg_desde_inicio":1020,"secoes":149,"pct_secoes":1.5518,"aptos":51062,"comparecimento":42781,"votos":{"13":24637,"22":15685,"branco":520,"nulo":1939}},
    {"t":"2022-10-30T17:18:00-03:00","seg_desde_inicio":1080,"secoes":185,"pct_secoes":1.9267,"aptos":63458,"comparecimento":53184,"votos":{"13":30958,"22":19079,"branco":675,"nulo":2472}},
    {"t":"2022-10-30T17:19:00-03:00","seg_desde_inicio":1140,"secoes":257,"pct_secoes":2.6765,"aptos":88296,"comparecimento":74159,"votos":{"13":43493,"22":26399,"branco":937,"nulo":3330}},
    {"t":"2022-10-30T17:20:00-03:00","seg_desde_inicio":1200,"secoes":343,"pct_secoes":3.5722,"aptos":118068,"comparecimento":99052,"votos":{"13":58245,"22":35119,"branco":1263,"nulo":4425}},
    {"t":"2022-10-30T17:21:00-03:00","seg_desde_inicio":1260,"secoes":418,"pct_secoes":4.3533,"aptos":143423,"comparecimento":120411,"votos":{"13":71562,"22":41782,"branco":1542,"nulo":5525}},
    {"t":"2022-10-30T17:22:00-03:00","seg_desde_inicio":1320,"secoes":489,"pct_secoes":5.0927,"aptos":166621,"comparecimento":139943,"votos":{"13":83902,"22":47721,"branco":1816,"nulo":6504}},
    {"t":"2022-10-30T17:23:00-03:00","seg_desde_inicio":1380,"secoes":599,"pct_secoes":6.2383,"aptos":202722,"comparecimento":170017,"votos":{"13":102069,"22":57693,"branco":2255,"nulo":8000}},
    {"t":"2022-10-30T17:24:00-03:00","seg_desde_inicio":1440,"secoes":685,"pct_secoes":7.1339,"aptos":231338,"comparecimento":193944,"votos":{"13":116858,"22":65384,"branco":2557,"nulo":9145}},
    {"t":"2022-10-30T17:25:00-03:00","seg_desde_inicio":1500,"secoes":788,"pct_secoes":8.2066,"aptos":265068,"comparecimento":221920,"votos":{"13":134413,"22":74220,"branco":2919,"nulo":10368}},
    {"t":"2022-10-30T17:26:00-03:00","seg_desde_inicio":1560,"secoes":950,"pct_secoes":9.8938,"aptos":318197,"comparecimento":266296,"votos":{"13":162258,"22":87837,"branco":3540,"nulo":12661}},
    {"t":"2022-10-30T17:27:00-03:00","seg_desde_inicio":1620,"secoes":1110,"pct_secoes":11.5601,"aptos":370794,"comparecimento":310001,"votos":{"13":189834,"22":101004,"branco":4188,"nulo":14975}},
    {"t":"2022-10-30T17:28:00-03:00","seg_desde_inicio":1680,"secoes":1208,"pct_secoes":12.5807,"aptos":401489,"comparecimento":335227,"votos":{"13":206030,"22":108532,"branco":4483,"nulo":16182}},
    {"t":"2022-10-30T17:29:00-03:00","seg_desde_inicio":1740,"secoes":1334,"pct_secoes":13.8929,"aptos":442921,"comparecimento":369616,"votos":{"13":227209,"22":119530,"branco":4917,"nulo":17960}},
    {"t":"2022-10-30T17:30:00-03:00","seg_desde_inicio":1800,"secoes":1497,"pct_secoes":15.5905,"aptos":497155,"comparecimento":414718,"votos":{"13":255597,"22":133439,"branco":5496,"nulo":20186}},
    {"t":"2022-10-30T17:31:00-03:00","seg_desde_inicio":1860,"secoes":1624,"pct_secoes":16.9131,"aptos":537452,"comparecimento":447953,"votos":{"13":277582,"22":142572,"branco":5945,"nulo":21854}},
    {"t":"2022-10-30T17:32:00-03:00","seg_desde_inicio":1920,"secoes":1735,"pct_secoes":18.0692,"aptos":573350,"comparecimento":477471,"votos":{"13":297054,"22":150654,"branco":6319,"nulo":23444}},
    {"t":"2022-10-30T17:33:00-03:00","seg_desde_inicio":1980,"secoes":1885,"pct_secoes":19.6313,"aptos":620721,"comparecimento":516457,"votos":{"13":322214,"22":161900,"branco":6841,"nulo":25502}},
    {"t":"2022-10-30T17:34:00-03:00","seg_desde_inicio":2040,"secoes":1991,"pct_secoes":20.7353,"aptos":653216,"comparecimento":543343,"votos":{"13":339681,"22":169597,"branco":7197,"nulo":26868}},
    {"t":"2022-10-30T17:35:00-03:00","seg_desde_inicio":2100,"secoes":2089,"pct_secoes":21.7559,"aptos":685620,"comparecimento":570140,"votos":{"13":357472,"22":176812,"branco":7578,"nulo":28278}},
    {"t":"2022-10-30T17:36:00-03:00","seg_desde_inicio":2160,"secoes":2232,"pct_secoes":23.2452,"aptos":731546,"comparecimento":608375,"votos":{"13":382044,"22":187901,"branco":8120,"nulo":30310}},
    {"t":"2022-10-30T17:37:00-03:00","seg_desde_inicio":2220,"secoes":2380,"pct_secoes":24.7865,"aptos":777365,"comparecimento":646043,"votos":{"13":407265,"22":197766,"branco":8630,"nulo":32382}},
    {"t":"2022-10-30T17:38:00-03:00","seg_desde_inicio":2280,"secoes":2514,"pct_secoes":26.182,"aptos":820414,"comparecimento":681483,"votos":{"13":431200,"22":207103,"branco":9090,"nulo":34090}},
    {"t":"2022-10-30T17:39:00-03:00","seg_desde_inicio":2340,"secoes":2626,"pct_secoes":27.3485,"aptos":855841,"comparecimento":710111,"votos":{"13":451214,"22":213808,"branco":9436,"nulo":35653}},
    {"t":"2022-10-30T17:40:00-03:00","seg_desde_inicio":2400,"secoes":2764,"pct_secoes":28.7857,"aptos":900274,"comparecimento":747192,"votos":{"13":473657,"22":225979,"branco":9957,"nulo":37599}},
    {"t":"2022-10-30T17:41:00-03:00","seg_desde_inicio":2460,"secoes":2877,"pct_secoes":29.9625,"aptos":936113,"comparecimento":776743,"votos":{"13":492136,"22":235240,"branco":10361,"nulo":39006}},
    {"t":"2022-10-30T17:42:00-03:00","seg_desde_inicio":2520,"secoes":2972,"pct_secoes":30.9519,"aptos":965777,"comparecimento":801196,"votos":{"13":508291,"22":241952,"branco":10684,"nulo":40269}},
    {"t":"2022-10-30T17:43:00-03:00","seg_desde_inicio":2580,"secoes":3051,"pct_secoes":31.7746,"aptos":991023,"comparecimento":822186,"votos":{"13":522215,"22":247729,"branco":10989,"nulo":41253}},
    {"t":"2022-10-30T17:44:00-03:00","seg_desde_inicio":2640,"secoes":3203,"pct_secoes":33.3576,"aptos":1041039,"comparecimento":863547,"votos":{"13":548276,"22":260351,"branco":11546,"nulo":43374}},
    {"t":"2022-10-30T17:45:00-03:00","seg_desde_inicio":2700,"secoes":3322,"pct_secoes":34.597,"aptos":1080293,"comparecimento":895510,"votos":{"13":568800,"22":269682,"branco":11973,"nulo":45055}},
    {"t":"2022-10-30T17:46:00-03:00","seg_desde_inicio":2760,"secoes":3442,"pct_secoes":35.8467,"aptos":1119542,"comparecimento":927752,"votos":{"13":588901,"22":279850,"branco":12426,"nulo":46575}},
    {"t":"2022-10-30T17:47:00-03:00","seg_desde_inicio":2820,"secoes":3563,"pct_secoes":37.1069,"aptos":1156915,"comparecimento":958649,"votos":{"13":608262,"22":289477,"branco":12804,"nulo":48106}},
    {"t":"2022-10-30T17:48:00-03:00","seg_desde_inicio":2880,"secoes":3680,"pct_secoes":38.3253,"aptos":1194286,"comparecimento":989799,"votos":{"13":627741,"22":299002,"branco":13174,"nulo":49882}},
    {"t":"2022-10-30T17:49:00-03:00","seg_desde_inicio":2940,"secoes":3842,"pct_secoes":40.0125,"aptos":1246800,"comparecimento":1033935,"votos":{"13":655371,"22":312557,"branco":13806,"nulo":52201}},